{
  "version": "clafer-bounds/2",
  "objects": 3,
  "bitwidth": 4,
  "declarations": [
    {
      "id": 0,
      "size": 1,
      "exact": true
    },
    {
      "id": 1,
      "size": 1,
      "exact": true
    },
    {
      "id": 2,
      "size": 1,
      "exact": true
    },
    {
      "id": 3,
      "size": 2,
      "exact": true
    }
  ],
  "integers": [
    {
      "id": 3,
      "lower": -1,
      "upper": 1
    }
  ]
}
